{
  "schemaVersion": 1,
  "objectives": [
    { "id": "predict-equilibrium-shift", "text": { "zh-CN": "使用 Q 与 K 的关系预测化学平衡移动方向。", "en": "Use the relationship between Q and K to predict the direction of equilibrium shift." } },
    { "id": "distinguish-rate-equilibrium", "text": { "zh-CN": "区分催化剂对反应速率和平衡组成的不同影响。", "en": "Distinguish a catalyst's effect on reaction rate from its effect on equilibrium composition." } }
  ],
  "prerequisites": [{ "zh-CN": "理解可逆反应、物质的量浓度和化学平衡常数。", "en": "Understands reversible reactions, molar concentration, and equilibrium constants." }],
  "misconceptions": [
    { "id": "catalyst-shifts-equilibrium", "text": { "zh-CN": "误以为催化剂会改变平衡常数或平衡组成。", "en": "Assuming a catalyst changes the equilibrium constant or equilibrium composition." }, "objectiveIds": ["distinguish-rate-equilibrium"] },
    { "id": "pressure-always-right", "text": { "zh-CN": "误以为增大压强总会使平衡正向移动。", "en": "Assuming higher pressure always shifts equilibrium toward products." }, "objectiveIds": ["predict-equilibrium-shift"] }
  ],
  "scenes": [
    {
      "id": "control-equilibrium", "type": "simulate", "title": { "zh-CN": "调控 N₂O₄ ⇌ 2NO₂", "en": "Control N₂O₄ ⇌ 2NO₂" },
      "objectiveIds": ["predict-equilibrium-shift", "distinguish-rate-equilibrium"], "evidenceIds": ["reaction-quotient-direction", "catalyst-equilibrium-claim"],
      "component": { "type": "deterministic-equilibrium-simulator", "config": { "reaction": "N2O4 ⇌ 2NO2", "initialVolume": 1, "initialTemperature": 298, "initialKc": 0.36 } },
      "fallback": { "zh-CN": "若动画不可用，请直接读取 Q、K 与最终浓度表；Q<K 时正向移动，Q>K 时逆向移动。", "en": "If animation is unavailable, use the Q, K, and final-concentration table; Q<K shifts forward and Q>K shifts backward." }
    }
  ],
  "checkpoints": [
    { "id": "predict-compression", "sceneId": "control-equilibrium", "objectiveIds": ["predict-equilibrium-shift"], "kind": "multiple-choice", "prompt": { "zh-CN": "恒温压缩容器后，N₂O₄ ⇌ 2NO₂ 的平衡向哪边移动？", "en": "After isothermal compression, which way does N₂O₄ ⇌ 2NO₂ shift?" }, "answer": "left" },
    { "id": "predict-catalyst", "sceneId": "control-equilibrium", "objectiveIds": ["distinguish-rate-equilibrium"], "kind": "multiple-choice", "prompt": { "zh-CN": "加入催化剂后，最终平衡组成怎样变化？", "en": "How does a catalyst change the final equilibrium composition?" }, "answer": "unchanged" }
  ],
  "completion": { "objectiveIds": ["predict-equilibrium-shift", "distinguish-rate-equilibrium"], "checkpointIds": ["predict-compression", "predict-catalyst"] }
}
